Language,original,english,czech,german,russian,polish,hungarian,italian,spanish,french,chinese,japanese,portuguese,chinesesimp
STR_craftnmBandana,"Craft Bandana","Craft Bandana","Vytvořit bandanu","Bandana herstellen","Сделать бандану","Zrób bandanę","Bandana készítése","Crea Bandana","Crear Bandana","Fabriquer bandana","制作头巾","バンダナを作る","Criar Bandana","制作头巾"
STR_nmSlingbagDummyDISC,"A simple bag made from a flag and a rope. Discreet yet effective.","A simple bag made from a flag and a rope. Discreet yet effective.","Jednoduchý vak vyrobený z vlajky a provazu. Nenápadný, ale účinný.","Ein einfacher Beutel aus einer Fahne und einem Seil. Unauffällig, aber effektiv.","Простая сумка из флага и веревки. Незаметная, но эффективная.","Prosta torba wykonana z flagi i liny. Dyskretna, ale skuteczna.","Egyszerű táska zászlóból és kötélből. Diszkrét, mégis hatékony.","Una semplice borsa fatta con una bandiera e una corda. Discreta ma efficace.","Una bolsa simple hecha con una bandera y una cuerda. Discreta pero eficaz.","Un sac simple fait avec un drapeau et une corde. Discret mais efficace.","由旗帜和绳索制成的简单袋子。低调而有效。","旗とロープで作られたシンプルなバッグ。目立たないが効果的。","Uma bolsa simples feita de uma bandeira e uma corda. Discreta, mas eficaz.","由旗帜和绳索制成的简单袋子。低调而有效。"
STR_nmCraftSlingbagDummy,"Craft improvised slingbag","Craft improvised slingbag","Vytvořit improvizovaný vak","Improvisierte Umhängetasche herstellen","Сделать самодельную сумку","Stwórz improwizowaną torbę na ramię","Improvizált parittyazsák készítése","Crea borsa a tracolla improvvisata","Crear bandolera improvisada","Fabriquer une sacoche improvisée","制作简易背包","即席スリングバッグを作成","Criar mochila improvisada","制作简易背包"
STR_nmSlingbagDummy,"Improvised Slingbag","Improvised Slingbag","Improvizovaný vak","Improvisierte Umhängetasche","Самодельная сумка","Improwizowana torba na ramię","Improvizált parittyazsák","Borsa a tracolla improvvisata","Bandolera improvisada","Sacoche improvisée","简易背包","即席スリングバッグ","Mochila improvisada","简易背包"
STR_CraftnmImproBag,"Craft improvised backpack","Craft improvised backpack","Vytvořit improvizovaný batoh","Improvisierten Rucksack herstellen","Сделать самодельный рюкзак","Stwórz improwizowany plecak","Improvizált hátizsák készítése","Crea zaino improvvisato","Crear mochila improvisada","Fabriquer un sac à dos improvisé","制作简易背包","即席のバックパックを作成","Criar mochila improvisada","制作简易背包"
STR_nmImproBag,"Improvised Backpack","Improvised Backpack","Improvizovaný batoh","Improvisierter Rucksack","Самодельный рюкзак","Improwizowany plecak","Improvizált hátizsák","Zaino improvvisato","Mochila improvisada","Sac à dos improvisé","简易背包","即席のバックパック","Mochila improvisada","简易背包"
STR_nmImproBagDISC,"Low profile improvised backpack made from a flag and a wooden frame. Not too rigid, but very practical.","Low profile improvised backpack made from a flag and a wooden frame. Not too rigid, but very practical.","Nízkoprofilový improvizovaný batoh vyrobený z vlajky a dřevěného rámu. Není příliš tuhý, ale velmi praktický.","Niedrigprofiliger improvisierter Rucksack, hergestellt aus einer Fahne und einem Holzrahmen. Nicht zu starr, aber sehr praktisch.","Низкопрофильный самодельный рюкзак, сделанный из флага и деревянного каркаса. Не слишком жесткий, но очень практичный.","Niskoprofilowy improwizowany plecak wykonany z flagi i drewnianej ramy. Niezbyt sztywny, ale bardzo praktyczny.","Alacsony profilú, zászlóból és fakeretből készült improvizált hátizsák. Nem túl merev, de nagyon praktikus.","Zaino improvvisato a basso profilo fatto con una bandiera e una cornice di legno. Non troppo rigido, ma molto pratico.","Mochila improvisada de bajo perfil hecha con una bandera y un marco de madera. No muy rígida, pero muy práctica.","Sac à dos improvisé à profil bas, fabriqué à partir d'un drapeau et d'un cadre en bois. Pas trop rigide, mais très pratique.","由旗帜和木框制成的低调简易背包。不太硬，但非常实用。","旗と木枠で作られたロープロファイルの即席バックパック。あまり硬くはありませんが、とても実用的です。","Mochila improvisada de baixo perfil feita de uma bandeira e uma moldura de madeira. Não muito rígida, mas muito prática.","由旗帜和木框制成的低调简易背包。不太硬，但非常实用。"
,"","","","","","","","","","","","","",""